{
  "$schema": "../schemas/primitive-release.schema.json",
  "schemaVersion": 1,
  "releaseId": "urn:agentic-delivery:primitive-release:0.1.0-draft.13",
  "version": "0.1.0-draft.13",
  "status": "draft",
  "architecture": {
    "id": "urn:agentic-delivery:architecture:authority",
    "version": "0.1.0-draft.24",
    "releaseManifestCommit": "61d99cbcca175f5bb5de4277d21f2ce4d56cbd0c",
    "releaseManifestSha256": "7ffb17661195fcc224b3fdd493e6a68233dcaee4400eae7cc0dd0a97ef4fba69",
    "sourceCommit": "7b1d21462f70c411e75ae67ce80dcf688c9973e8",
    "decisionInventoryPath": "architecture/references/decision-inventory.yml",
    "decisionInventorySha256": "87f5c8bb2c03ca7208c7ed29f7eeb5ccb8735e17b3d52c7ad126f68dd798a592"
  },
  "sourceCommit": "cf3193ab127a0906fa1ffc8fbb5efaf0c5ccce1b",
  "contentSha256": "6ad53cd3d2d2aff284fab042fb46993c2a84d5d386397c7523298d275b90e444",
  "capabilityPolicyVersion": "0.1.0"
}
